{
  "last_updated": "2026-10-14",
  "metadata": {
    "time": "11:00 AM – 12:00 PM",
    "location": "W.E. Upjohn, 300 S Westnedge Ave"
  },
  "upcoming_meetings": [
    {
      "date": "2026-12-02",
      "display": "Wednesday, December 2, 2026",
      "time": "11:00 AM – 12:00 PM"
    }
  ],
  "meetings": [
    {
      "date": "2026-08-26",
      "display": "August 26, 2026"
    },
    {
      "date": "2026-05-27",
      "display": "May 27, 2026"
    }
  ]
}
