{
  "last_updated": "2026-10-17",
  "metadata": {
    "time": "04:00 PM – 06:00 PM",
    "location": "City Hall, 241 W South St"
  },
  "upcoming_meetings": [
    {
      "date": "2026-11-19",
      "display": "Thursday, November 19, 2026",
      "time": "04:00 PM – 06:00 PM"
    },
    {
      "date": "2026-12-17",
      "display": "Thursday, December 17, 2026",
      "time": "04:00 PM – 06:00 PM"
    }
  ],
  "meetings": [
    {
      "date": "2026-10-15",
      "display": "Thursday, October 15, 2026",
      "minutes_url": null,
      "agenda_url": null,
      "location": null,
      "scrapedAt": "2026-10-16T06:39:19.032609+00:00",
      "sourceUrl": "https://www.kalamazoocity.org/Government/Boards-Commissions/Building-Board-of-Appeals",
      "isCancelled": true,
      "link_label": "Cancelled"
    },
    {
      "date": "2026-09-17",
      "display": "Thursday, September 17, 2026",
      "minutes_url": null,
      "agenda_url": null,
      "location": null,
      "scrapedAt": "2026-09-18T07:02:42.614886+00:00",
      "sourceUrl": "https://www.kalamazoocity.org/Government/Boards-Commissions/Building-Board-of-Appeals",
      "link_label": "No documents posted",
      "isCancelled": true
    },
    {
      "date": "2026-08-20",
      "display": "August 20, 2026"
    },
    {
      "date": "2026-07-16",
      "display": "Thursday, July 16, 2026",
      "link_label": "Cancelled",
      "isCancelled": true,
      "minutes_url": null,
      "agenda_url": null,
      "location": null,
      "scrapedAt": "2026-07-19T00:45:32.856037+00:00",
      "sourceUrl": "https://www.kalamazoocity.org/Government/Boards-Commissions/Building-Board-of-Appeals"
    },
    {
      "date": "2026-06-18",
      "display": "Thursday, June 18, 2026",
      "link_label": "Cancelled",
      "isCancelled": true,
      "minutes_url": null,
      "agenda_url": null,
      "location": null,
      "scrapedAt": "2026-07-19T00:45:32.856046+00:00",
      "sourceUrl": "https://www.kalamazoocity.org/Government/Boards-Commissions/Building-Board-of-Appeals"
    },
    {
      "date": "2026-05-21",
      "display": "Thursday, May 21, 2026",
      "minutes_url": null,
      "agenda_url": null,
      "location": null,
      "scrapedAt": "2026-09-02T01:33:15.241950+00:00",
      "sourceUrl": null,
      "link_label": "Cancelled",
      "isCancelled": true,
      "cancelNote": "Not on the city's list of past meeting dates"
    },
    {
      "date": "2026-04-16",
      "display": "April 16, 2026"
    }
  ]
}
