{
  "last_updated": "2026-10-29",
  "metadata": {
    "time": "12:00 PM – 02:00 PM",
    "location": "TBD"
  },
  "upcoming_meetings": [
    {
      "date": "2026-11-19",
      "display": "Thursday, November 19, 2026",
      "time": "12:00 PM – 02:00 PM"
    },
    {
      "date": "2026-12-17",
      "display": "Thursday, December 17, 2026",
      "time": "12:00 PM – 02:00 PM"
    }
  ],
  "meetings": [
    {
      "date": "2026-10-15",
      "display": "Thursday, October 15, 2026",
      "minutes_url": null,
      "agenda_url": null,
      "location": null,
      "scrapedAt": "2026-10-16T06:39:19.004767+00:00",
      "sourceUrl": "https://www.kalamazoocity.org/Government/Boards-Commissions/Kalamazoo-Municipal-Golf-Association",
      "link_label": "No documents posted"
    },
    {
      "date": "2026-09-17",
      "display": "Thursday, September 17, 2026",
      "minutes_url": null,
      "agenda_url": null,
      "location": null,
      "scrapedAt": "2026-09-18T07:02:41.491302+00:00",
      "sourceUrl": "https://www.kalamazoocity.org/Government/Boards-Commissions/Kalamazoo-Municipal-Golf-Association",
      "link_label": "No documents posted"
    },
    {
      "date": "2026-08-20",
      "display": "August 20, 2026"
    },
    {
      "date": "2026-07-16",
      "display": "July 16, 2026"
    },
    {
      "date": "2026-06-18",
      "display": "June 18, 2026"
    },
    {
      "date": "2026-05-21",
      "display": "May 21, 2026"
    },
    {
      "date": "2026-04-16",
      "display": "April 16, 2026"
    }
  ]
}
