{
  "last_updated": "2026-10-11",
  "metadata": {
    "time": "On Call",
    "location": "City Hall, 241 W South St",
    "meetingScheduleNote": "Meets biennially, typically in December of odd-numbered years"
  },
  "upcoming_meetings": [],
  "meetings": [
    {
      "date": "2025-12-16",
      "display": "December 16, 2025",
      "event_id": 2583,
      "url": "https://kalamazoomi.portal.civicclerk.com/event/2583/files/agenda/4561",
      "link_label": "Agenda & Minutes",
      "meeting_type": "Local Officers Compensation Commission",
      "minutes_url": "https://kalamazoomi.portal.civicclerk.com/event/2583/files/agenda/4649",
      "agenda_url": "https://kalamazoomi.portal.civicclerk.com/event/2583/files/agenda/4561",
      "isCancelled": false
    },
    {
      "date": "2023-12-12",
      "display": "December 12, 2023",
      "event_id": 955,
      "url": "https://kalamazoomi.portal.civicclerk.com/event/955/files/agenda/2445",
      "link_label": "Agenda & Minutes",
      "meeting_type": "Local Officers Compensation Commission",
      "minutes_url": "https://kalamazoomi.portal.civicclerk.com/event/955/files/agenda/2448",
      "agenda_url": "https://kalamazoomi.portal.civicclerk.com/event/955/files/agenda/2445",
      "isCancelled": false
    },
    {
      "date": "2021-12-14",
      "display": "December 14, 2021",
      "event_id": 537,
      "url": "https://kalamazoomi.portal.civicclerk.com/event/537/files/agenda/1163",
      "link_label": "Agenda & Minutes",
      "meeting_type": "Local Officers Compensation Commission",
      "minutes_url": "https://kalamazoomi.portal.civicclerk.com/event/537/files/agenda/2447",
      "agenda_url": "https://kalamazoomi.portal.civicclerk.com/event/537/files/agenda/1163",
      "isCancelled": false
    }
  ]
}
