{
  "last_updated": "2026-10-27",
  "metadata": {
    "time": "12:30 PM – 2:00 PM",
    "location": "Rose St Offices, 245 N Rose St",
    "meetingScheduleNote": "Meets the second Monday of every other month — confirmed dates posted when available"
  },
  "upcoming_meetings": [],
  "meetings": [
    {
      "date": "2026-07-13",
      "display": "Monday, July 13, 2026",
      "minutes_url": null,
      "agenda_url": null,
      "location": null,
      "scrapedAt": "2026-09-02T01:33:17.659595+00:00",
      "sourceUrl": null,
      "link_label": "Cancelled",
      "isCancelled": true,
      "cancelNote": "Not on the city's list of past meeting dates"
    },
    {
      "date": "2026-05-11",
      "display": "Monday, May 11, 2026",
      "minutes_url": null,
      "agenda_url": null,
      "location": null,
      "scrapedAt": "2026-09-02T01:33:17.659575+00:00",
      "sourceUrl": null,
      "link_label": "Cancelled",
      "isCancelled": true,
      "cancelNote": "Not on the city's list of past meeting dates"
    },
    {
      "date": "2025-11-10",
      "display": "November 10, 2025",
      "event_id": 2514,
      "url": "https://kalamazoomi.portal.civicclerk.com/event/2514/files/agenda/4414",
      "link_label": "Agenda",
      "meeting_type": "SPK Organizing Committee",
      "minutes_url": null,
      "agenda_url": "https://kalamazoomi.portal.civicclerk.com/event/2514/files/agenda/4414",
      "isCancelled": false
    },
    {
      "date": "2025-09-08",
      "display": "September 8, 2025",
      "event_id": 2513,
      "url": "https://kalamazoomi.portal.civicclerk.com/event/2513/files/agenda/4246",
      "link_label": "Agenda",
      "meeting_type": "SPK Organizing Committee",
      "minutes_url": null,
      "agenda_url": "https://kalamazoomi.portal.civicclerk.com/event/2513/files/agenda/4246",
      "isCancelled": false
    },
    {
      "date": "2025-07-14",
      "display": "July 14, 2025",
      "event_id": 2512,
      "url": "https://kalamazoomi.portal.civicclerk.com/event/2512/files/agenda/4067",
      "link_label": "Agenda",
      "meeting_type": "SPK Organizing Committee",
      "minutes_url": null,
      "agenda_url": "https://kalamazoomi.portal.civicclerk.com/event/2512/files/agenda/4067",
      "isCancelled": false
    },
    {
      "date": "2025-03-10",
      "display": "March 10, 2025",
      "event_id": 2505,
      "url": "https://kalamazoomi.portal.civicclerk.com/event/2505/files/agenda/3680",
      "link_label": "Agenda",
      "meeting_type": "SPK Organizing Committee",
      "minutes_url": null,
      "agenda_url": "https://kalamazoomi.portal.civicclerk.com/event/2505/files/agenda/3680",
      "isCancelled": false
    },
    {
      "date": "2025-01-13",
      "display": "January 13, 2025",
      "event_id": 2461,
      "url": "https://kalamazoomi.portal.civicclerk.com/event/2461/files/agenda/3525",
      "link_label": "Agenda & Minutes",
      "meeting_type": "SPK Organizing Committee",
      "minutes_url": "https://kalamazoomi.portal.civicclerk.com/event/2461/files/agenda/3720",
      "agenda_url": "https://kalamazoomi.portal.civicclerk.com/event/2461/files/agenda/3525",
      "isCancelled": false
    },
    {
      "date": "2024-11-04",
      "display": "November 4, 2024",
      "event_id": 1083,
      "url": "https://kalamazoomi.portal.civicclerk.com/event/1083/files/agenda/3301",
      "link_label": "Agenda & Minutes",
      "meeting_type": "SPK Organizing Committee",
      "minutes_url": "https://kalamazoomi.portal.civicclerk.com/event/1083/files/agenda/3719",
      "agenda_url": "https://kalamazoomi.portal.civicclerk.com/event/1083/files/agenda/3301",
      "isCancelled": false
    },
    {
      "date": "2024-09-09",
      "display": "September 9, 2024",
      "event_id": 946,
      "url": "https://kalamazoomi.portal.civicclerk.com/event/946/files/agenda/3129",
      "link_label": "Agenda & Minutes",
      "meeting_type": "SPK Organizing Committee",
      "minutes_url": "https://kalamazoomi.portal.civicclerk.com/event/946/files/agenda/3434",
      "agenda_url": "https://kalamazoomi.portal.civicclerk.com/event/946/files/agenda/3129",
      "isCancelled": false
    },
    {
      "date": "2024-07-01",
      "display": "July 1, 2024",
      "event_id": 945,
      "url": "https://kalamazoomi.portal.civicclerk.com/event/945/files/agenda/2971",
      "link_label": "Agenda & Minutes",
      "meeting_type": "SPK Organizing Committee",
      "minutes_url": "https://kalamazoomi.portal.civicclerk.com/event/945/files/agenda/3313",
      "agenda_url": "https://kalamazoomi.portal.civicclerk.com/event/945/files/agenda/2971",
      "isCancelled": false
    },
    {
      "date": "2024-05-06",
      "display": "May 6, 2024",
      "event_id": 1080,
      "url": "https://kalamazoomi.portal.civicclerk.com/event/1080/files/agenda/2828",
      "link_label": "Agenda & Minutes",
      "meeting_type": "SPK Organizing Committee",
      "minutes_url": "https://kalamazoomi.portal.civicclerk.com/event/1080/files/agenda/3312",
      "agenda_url": "https://kalamazoomi.portal.civicclerk.com/event/1080/files/agenda/2828",
      "isCancelled": false
    },
    {
      "date": "2024-03-04",
      "display": "March 4, 2024",
      "event_id": 943,
      "url": "https://kalamazoomi.portal.civicclerk.com/event/943/files/agenda/2666",
      "link_label": "Agenda & Minutes",
      "meeting_type": "SPK Organizing Committee",
      "minutes_url": "https://kalamazoomi.portal.civicclerk.com/event/943/files/agenda/3311",
      "agenda_url": "https://kalamazoomi.portal.civicclerk.com/event/943/files/agenda/2666",
      "isCancelled": false
    }
  ]
}
