{
  "last_updated": "2026-10-14",
  "metadata": {
    "time": "TBD",
    "location": "City Hall, 241 W South St",
    "meetingScheduleNote": "Seasonal — March hearings, July and December corrections"
  },
  "upcoming_meetings": [],
  "meetings": [
    {
      "date": "2026-07-22",
      "display": "July 22, 2026"
    }
  ]
}
