{
  "last_updated": "2026-10-13",
  "metadata": {
    "time": "",
    "location": "Kalamazoo Public Services, 415 E Stockbridge Ave",
    "meetingScheduleNote": "No regular schedule — special meetings called as needed"
  },
  "upcoming_meetings": [],
  "meetings": [
    {
      "date": "2026-06-15",
      "display": "June 15, 2026"
    },
    {
      "date": "2026-04-21",
      "display": "April 21, 2026"
    }
  ]
}
