{
  "last_updated": "2026-10-20",
  "metadata": {
    "time": "08:00 AM – 09:00 AM",
    "location": "City Hall, 241 W South St"
  },
  "upcoming_meetings": [
    {
      "date": "2026-12-09",
      "display": "Wednesday, December 9, 2026",
      "time": "08:00 AM – 09:00 AM"
    }
  ],
  "meetings": [
    {
      "date": "2026-09-02",
      "display": "September 2, 2026",
      "event_id": 2598,
      "url": "https://kalamazoomi.portal.civicclerk.com/event/2598/overview",
      "link_label": "Meeting Record",
      "isCancelled": false,
      "minutes_url": null,
      "agenda_url": null,
      "location": null,
      "sourceUrl": "https://kalamazoomi.portal.civicclerk.com/event/2598/overview",
      "scrapedAt": "2026-09-02T02:45:19.188471+00:00",
      "meeting_type": "Employees Retirement System Board of Trustees (Pension Board)"
    },
    {
      "date": "2026-07-22",
      "display": "Wednesday, July 22, 2026",
      "minutes_url": null,
      "agenda_url": null,
      "location": "Community Room at City Hall, 241 W. South Street",
      "scrapedAt": "2026-09-02T01:33:16.546021+00:00",
      "sourceUrl": null,
      "link_label": "No documents posted"
    },
    {
      "date": "2026-06-03",
      "display": "June 3, 2026",
      "event_id": 2597,
      "url": "https://kalamazoomi.portal.civicclerk.com/event/2597/files/agenda/5099",
      "link_label": "Agenda",
      "isCancelled": false,
      "minutes_url": null,
      "agenda_url": "https://kalamazoomi.portal.civicclerk.com/event/2597/files/agenda/5099",
      "location": null,
      "sourceUrl": "https://kalamazoomi.portal.civicclerk.com/event/2597/overview",
      "scrapedAt": "2026-06-06T21:50:32.541893+00:00",
      "meeting_type": "Employees Retirement System Board of Trustees (Pension Board)"
    },
    {
      "date": "2026-03-04",
      "display": "March 4, 2026",
      "event_id": 2596,
      "url": "https://kalamazoomi.portal.civicclerk.com/event/2596/overview",
      "link_label": "Meeting Record",
      "isCancelled": false,
      "minutes_url": null,
      "agenda_url": null,
      "location": null,
      "sourceUrl": "https://kalamazoomi.portal.civicclerk.com/event/2596/overview",
      "scrapedAt": null,
      "meeting_type": "Employees Retirement System Board of Trustees (Pension Board)"
    },
    {
      "date": "2025-12-10",
      "display": "December 10, 2025",
      "event_id": 2503,
      "url": "https://kalamazoomi.portal.civicclerk.com/event/2503/files/agenda/4502",
      "link_label": "Agenda & Minutes",
      "meeting_type": "Pension Board",
      "minutes_url": "https://kalamazoomi.portal.civicclerk.com/event/2503/files/agenda/4699",
      "agenda_url": "https://kalamazoomi.portal.civicclerk.com/event/2503/files/agenda/4502",
      "isCancelled": false
    },
    {
      "date": "2025-09-03",
      "display": "September 3, 2025",
      "event_id": 2502,
      "url": "https://kalamazoomi.portal.civicclerk.com/event/2502/files",
      "link_label": "Agenda & Minutes",
      "meeting_type": "Pension Board",
      "minutes_url": "https://kalamazoomi.portal.civicclerk.com/event/2502/files/agenda/4668",
      "agenda_url": "https://kalamazoomi.portal.civicclerk.com/event/2502/files/agenda/4668",
      "isCancelled": false
    },
    {
      "date": "2025-06-04",
      "display": "June 4, 2025",
      "event_id": 2501,
      "url": "https://kalamazoomi.portal.civicclerk.com/event/2501/files",
      "link_label": "Meeting Record",
      "meeting_type": "Pension Board",
      "minutes_url": null,
      "agenda_url": null,
      "isCancelled": true
    },
    {
      "date": "2025-03-05",
      "display": "March 5, 2025",
      "event_id": 2500,
      "url": "https://kalamazoomi.portal.civicclerk.com/event/2500/files",
      "link_label": "Agenda & Minutes",
      "meeting_type": "Pension Board",
      "minutes_url": "https://kalamazoomi.portal.civicclerk.com/event/2500/files/agenda/4697",
      "agenda_url": "https://kalamazoomi.portal.civicclerk.com/event/2500/files/agenda/3668",
      "isCancelled": false
    },
    {
      "date": "2024-12-11",
      "display": "December 11, 2024",
      "event_id": 1143,
      "url": "https://kalamazoomi.portal.civicclerk.com/event/1143/files",
      "link_label": "Agenda & Minutes",
      "meeting_type": "Pension Board",
      "minutes_url": "https://kalamazoomi.portal.civicclerk.com/event/1143/files/agenda/4696",
      "agenda_url": "https://kalamazoomi.portal.civicclerk.com/event/1143/files/agenda/4696",
      "isCancelled": false
    },
    {
      "date": "2024-09-04",
      "display": "September 4, 2024",
      "event_id": 1142,
      "url": "https://kalamazoomi.portal.civicclerk.com/event/1142/files",
      "link_label": "Agenda & Minutes",
      "meeting_type": "Pension Board",
      "minutes_url": null,
      "agenda_url": null,
      "isCancelled": false
    },
    {
      "date": "2024-06-05",
      "display": "June 5, 2024",
      "event_id": 1141,
      "url": "https://kalamazoomi.portal.civicclerk.com/event/1141/files",
      "link_label": "Agenda & Minutes",
      "meeting_type": "Pension Board",
      "minutes_url": "https://kalamazoomi.portal.civicclerk.com/event/1141/files/agenda/4695",
      "agenda_url": "https://kalamazoomi.portal.civicclerk.com/event/1141/files/agenda/4695",
      "isCancelled": false
    },
    {
      "date": "2024-03-13",
      "display": "March 13, 2024",
      "event_id": 1140,
      "url": "https://kalamazoomi.portal.civicclerk.com/event/1140/files",
      "link_label": "Agenda & Minutes",
      "meeting_type": "Pension Board",
      "minutes_url": "https://kalamazoomi.portal.civicclerk.com/event/1140/files/agenda/4694",
      "agenda_url": "https://kalamazoomi.portal.civicclerk.com/event/1140/files/agenda/4694",
      "isCancelled": false
    }
  ]
}
