{
  "last_updated": "2026-10-19",
  "metadata": {
    "time": "9:00 AM",
    "location": "TBD"
  },
  "upcoming_meetings": [],
  "meetings": [
    {
      "date": "2026-10-08",
      "display": "Thursday, October 8, 2026",
      "minutes_url": null,
      "agenda_url": null,
      "location": "City Records Center, 3001 S Burdick St",
      "scrapedAt": "2026-10-09T08:19:44.462287+00:00",
      "sourceUrl": "https://www.kalamazoocity.org/Government/Boards-Commissions/Election-Commission",
      "link_label": "No documents posted"
    },
    {
      "date": "2026-07-09",
      "display": "July 9, 2026",
      "link_label": "No documents posted",
      "minutes_url": null,
      "agenda_url": null,
      "location": "City Records Center, 3001 S Burdick St",
      "isCancelled": false,
      "scrapedAt": "2026-07-19T01:03:52.751208+00:00",
      "sourceUrl": "https://www.kalamazoocity.org/Government/Boards-Commissions/Election-Commission"
    },
    {
      "date": "2026-04-09",
      "display": "April 9, 2026",
      "event_id": 2763,
      "url": "https://kalamazoomi.portal.civicclerk.com/event/2763/files/agenda/4918",
      "link_label": "Agenda",
      "meeting_type": "Election Commission Meeting - Public Accuracy Test",
      "minutes_url": null,
      "agenda_url": "https://kalamazoomi.portal.civicclerk.com/event/2763/files/agenda/4918",
      "isCancelled": false
    },
    {
      "date": "2026-02-25",
      "display": "February 25, 2026",
      "event_id": 2749,
      "url": "https://kalamazoomi.portal.civicclerk.com/event/2749/files/agenda/4783",
      "link_label": "Agenda & Minutes",
      "meeting_type": "Election Commission Meeting",
      "minutes_url": "https://kalamazoomi.portal.civicclerk.com/event/2749/files/agenda/4925",
      "agenda_url": "https://kalamazoomi.portal.civicclerk.com/event/2749/files/agenda/4783",
      "isCancelled": false
    },
    {
      "date": "2025-12-17",
      "display": "December 17, 2025",
      "event_id": 2613,
      "url": "https://kalamazoomi.portal.civicclerk.com/event/2613/files/agenda/4575",
      "link_label": "Agenda & Minutes",
      "meeting_type": "City Election Commission",
      "minutes_url": "https://kalamazoomi.portal.civicclerk.com/event/2613/files/agenda/4650",
      "agenda_url": "https://kalamazoomi.portal.civicclerk.com/event/2613/files/agenda/4575",
      "isCancelled": false
    },
    {
      "date": "2025-10-09",
      "display": "October 9, 2025",
      "event_id": 2522,
      "url": "https://kalamazoomi.portal.civicclerk.com/event/2522/files/agenda/4347",
      "link_label": "Agenda & Minutes",
      "meeting_type": "Election Commission Meeting - Public Accuracy Test",
      "minutes_url": "https://kalamazoomi.portal.civicclerk.com/event/2522/files/agenda/4372",
      "agenda_url": "https://kalamazoomi.portal.civicclerk.com/event/2522/files/agenda/4347",
      "isCancelled": false
    },
    {
      "date": "2024-10-17",
      "display": "October 17, 2024",
      "event_id": 1222,
      "url": "https://kalamazoomi.portal.civicclerk.com/event/1222/files/agenda/3264",
      "link_label": "Agenda & Minutes",
      "meeting_type": "Election Commission Meeting - Public Accuracy Test",
      "minutes_url": "https://kalamazoomi.portal.civicclerk.com/event/1222/files/agenda/3294",
      "agenda_url": "https://kalamazoomi.portal.civicclerk.com/event/1222/files/agenda/3264",
      "isCancelled": false
    },
    {
      "date": "2024-10-14",
      "display": "October 14, 2024",
      "event_id": 1221,
      "url": "https://kalamazoomi.portal.civicclerk.com/event/1221/files/agenda/3239",
      "link_label": "Agenda & Minutes",
      "meeting_type": "Special Election Commission Meeting",
      "minutes_url": "https://kalamazoomi.portal.civicclerk.com/event/1221/files/agenda/3293",
      "agenda_url": "https://kalamazoomi.portal.civicclerk.com/event/1221/files/agenda/3239",
      "isCancelled": false
    },
    {
      "date": "2024-07-19",
      "display": "July 19, 2024",
      "event_id": 1193,
      "url": "https://kalamazoomi.portal.civicclerk.com/event/1193/files/agenda/3021",
      "link_label": "Agenda & Minutes",
      "meeting_type": "Election Commission Meeting - Public Accuracy Test",
      "minutes_url": "https://kalamazoomi.portal.civicclerk.com/event/1193/files/agenda/3039",
      "agenda_url": "https://kalamazoomi.portal.civicclerk.com/event/1193/files/agenda/3021",
      "isCancelled": false
    },
    {
      "date": "2024-07-15",
      "display": "July 15, 2024",
      "event_id": 1192,
      "url": "https://kalamazoomi.portal.civicclerk.com/event/1192/files/agenda/3008",
      "link_label": "Agenda & Minutes",
      "meeting_type": "Special Election Commission Meeting",
      "minutes_url": "https://kalamazoomi.portal.civicclerk.com/event/1192/files/agenda/3016",
      "agenda_url": "https://kalamazoomi.portal.civicclerk.com/event/1192/files/agenda/3008",
      "isCancelled": false
    },
    {
      "date": "2024-07-03",
      "display": "July 3, 2024",
      "event_id": 1191,
      "url": "https://kalamazoomi.portal.civicclerk.com/event/1191/files/agenda/2988",
      "link_label": "Agenda & Minutes",
      "meeting_type": "Special Election Commission Meeting",
      "minutes_url": "https://kalamazoomi.portal.civicclerk.com/event/1191/files/agenda/3017",
      "agenda_url": "https://kalamazoomi.portal.civicclerk.com/event/1191/files/agenda/2988",
      "isCancelled": false
    },
    {
      "date": "2024-02-01",
      "display": "February 1, 2024",
      "event_id": 1111,
      "url": "https://kalamazoomi.portal.civicclerk.com/event/1111/files/agenda/2572",
      "link_label": "Agenda & Minutes",
      "meeting_type": "Election Commission Meeting - Public Accuracy Test",
      "minutes_url": "https://kalamazoomi.portal.civicclerk.com/event/1111/files/agenda/3018",
      "agenda_url": "https://kalamazoomi.portal.civicclerk.com/event/1111/files/agenda/2572",
      "isCancelled": false
    },
    {
      "date": "2023-11-02",
      "display": "November 2, 2023",
      "event_id": 886,
      "url": "https://kalamazoomi.portal.civicclerk.com/event/886/files/agenda/2353",
      "link_label": "Agenda & Minutes",
      "meeting_type": "Election Commission Meeting - Public Accuracy Test",
      "minutes_url": "https://kalamazoomi.portal.civicclerk.com/event/886/files/agenda/2362",
      "agenda_url": "https://kalamazoomi.portal.civicclerk.com/event/886/files/agenda/2353",
      "isCancelled": false
    },
    {
      "date": "2023-08-30",
      "display": "August 30, 2023",
      "event_id": 878,
      "url": "https://kalamazoomi.portal.civicclerk.com/event/878/files/agenda/2189",
      "link_label": "Agenda & Minutes",
      "meeting_type": "City Election Commission",
      "minutes_url": "https://kalamazoomi.portal.civicclerk.com/event/878/files/agenda/2220",
      "agenda_url": "https://kalamazoomi.portal.civicclerk.com/event/878/files/agenda/2189",
      "isCancelled": false
    },
    {
      "date": "2023-04-10",
      "display": "April 10, 2023",
      "event_id": 875,
      "url": "https://kalamazoomi.portal.civicclerk.com/event/875/files/agenda/1885",
      "link_label": "Agenda & Minutes",
      "meeting_type": "Election Commission",
      "minutes_url": "https://kalamazoomi.portal.civicclerk.com/event/875/files/agenda/1889",
      "agenda_url": "https://kalamazoomi.portal.civicclerk.com/event/875/files/agenda/1885",
      "isCancelled": false
    },
    {
      "date": "2023-03-03",
      "display": "March 3, 2023",
      "event_id": 873,
      "url": "https://kalamazoomi.portal.civicclerk.com/event/873/files/agenda/1784",
      "link_label": "Agenda & Minutes",
      "meeting_type": "Special Election Commission Meeting",
      "minutes_url": "https://kalamazoomi.portal.civicclerk.com/event/873/files/agenda/1887",
      "agenda_url": "https://kalamazoomi.portal.civicclerk.com/event/873/files/agenda/1784",
      "isCancelled": false
    }
  ]
}
