{
  "last_updated": "2026-10-13",
  "metadata": {
    "time": "02:00 PM – 04:00 PM",
    "location": "City of Kalamazoo Stockbridge Facility, 415 E Stockbridge Ave"
  },
  "upcoming_meetings": [
    {
      "date": "2026-11-03",
      "display": "Tuesday, November 3, 2026",
      "time": "02:00 PM – 04:00 PM"
    },
    {
      "date": "2026-12-01",
      "display": "Tuesday, December 1, 2026",
      "time": "02:00 PM – 04:00 PM"
    }
  ],
  "meetings": [
    {
      "date": "2026-10-06",
      "display": "Tuesday, October 6, 2026",
      "minutes_url": null,
      "agenda_url": null,
      "location": null,
      "scrapedAt": "2026-10-07T08:02:47.247262+00:00",
      "sourceUrl": "https://www.kalamazoocity.org/Government/Boards-Commissions/Tree-Committee",
      "link_label": "No documents posted"
    },
    {
      "date": "2026-09-01",
      "display": "Tuesday, September 1, 2026",
      "minutes_url": null,
      "agenda_url": null,
      "location": null,
      "scrapedAt": "2026-09-02T01:33:17.859758+00:00",
      "sourceUrl": null,
      "link_label": "No documents posted"
    },
    {
      "date": "2026-08-04",
      "display": "August 4, 2026"
    },
    {
      "date": "2026-07-07",
      "display": "Tuesday, July 7, 2026",
      "link_label": "Cancelled",
      "isCancelled": true,
      "minutes_url": null,
      "agenda_url": null,
      "location": null,
      "scrapedAt": "2026-07-19T00:45:32.851151+00:00",
      "sourceUrl": "https://www.kalamazoocity.org/Government/Boards-Commissions/Tree-Committee"
    },
    {
      "date": "2026-06-02",
      "display": "June 2, 2026"
    },
    {
      "date": "2026-05-05",
      "display": "May 5, 2026"
    }
  ]
}
