{
  "last_updated": "2026-10-28",
  "metadata": {
    "time": "05:30 PM – 07:30 PM",
    "location": "TBD"
  },
  "upcoming_meetings": [
    {
      "date": "2026-11-10",
      "display": "Tuesday, November 10, 2026",
      "time": "05:30 PM – 07:30 PM"
    },
    {
      "date": "2026-12-08",
      "display": "Tuesday, December 8, 2026",
      "time": "05:30 PM – 07:30 PM"
    }
  ],
  "meetings": [
    {
      "date": "2026-10-06",
      "display": "Tuesday, October 6, 2026",
      "minutes_url": null,
      "agenda_url": null,
      "location": null,
      "scrapedAt": "2026-10-07T08:02:47.137636+00:00",
      "sourceUrl": "https://www.kalamazoocity.org/Government/Boards-Commissions/Parks-Recreation-Advisory-Board-PRAB",
      "link_label": "No documents posted"
    },
    {
      "date": "2026-09-09",
      "display": "Wednesday, September 9, 2026",
      "minutes_url": null,
      "agenda_url": null,
      "location": "Parks and Recreation Community Room at Mayors' Riverfront Park, 251 Mills Street",
      "scrapedAt": "2026-09-11T06:58:31.222663+00:00",
      "sourceUrl": "https://www.kalamazoocity.org/Government/Boards-Commissions/Parks-Recreation-Advisory-Board-PRAB",
      "rescheduledFrom": "2026-09-08",
      "link_label": "No documents posted"
    },
    {
      "date": "2026-08-05",
      "display": "Wednesday, August 5, 2026",
      "minutes_url": null,
      "agenda_url": null,
      "location": "Axtell Creek Park",
      "scrapedAt": "2026-09-02T01:33:17.466615+00:00",
      "sourceUrl": null,
      "link_label": "Cancelled",
      "rescheduledFrom": "2026-08-04",
      "isCancelled": true,
      "cancelNote": "Not on the city's list of past meeting dates"
    },
    {
      "date": "2026-07-07",
      "display": "July 7, 2026"
    },
    {
      "date": "2026-06-02",
      "display": "June 2, 2026"
    },
    {
      "date": "2026-05-05",
      "display": "May 5, 2026"
    }
  ]
}
